{
  "$schema": "../schema/leveranciers.schema.json",
  "versie": 1,
  "gegenereerdOp": "2026-09-30T17:46:46.461Z",
  "valuta": "EUR",
  "leveranciers": [
    {
      "id": "anwb",
      "naam": "ANWB Energie",
      "website": "https://www.anwb.nl/energie",
      "tariefUrl": "https://www.anwb.nl/energie/actuele-tarieven",
      "producten": {
        "stroom": true,
        "gas": true
      },
      "kenmerken": {
        "automatischAfschakelen": null
      },
      "tarieven": {
        "stroomVastPerMaand": {
          "bedragInclBtw": 8.52,
          "bedragExclBtw": 7.041322,
          "eenheid": "EUR/maand",
          "bron": "rekentool",
          "geverifieerd": true,
          "sinds": "2026-09-26T20:50:05.481Z",
          "laatstGecontroleerd": "2026-09-30T17:46:46.461Z",
          "bronUrl": "https://www.anwb.nl/energie/actuele-tarieven"
        },
        "stroomInkoopopslag": {
          "bedragInclBtw": 0.018,
          "bedragExclBtw": 0.014876,
          "eenheid": "EUR/kWh",
          "bron": "website",
          "geverifieerd": true,
          "sinds": "2026-09-26T20:50:05.481Z",
          "laatstGecontroleerd": "2026-09-30T17:46:46.461Z",
          "bronUrl": "https://www.anwb.nl/energie/actuele-tarieven"
        },
        "gasVastPerMaand": {
          "bedragInclBtw": 9.75,
          "bedragExclBtw": 8.057851,
          "eenheid": "EUR/maand",
          "bron": "rekentool",
          "geverifieerd": true,
          "sinds": "2026-09-26T20:50:05.481Z",
          "laatstGecontroleerd": "2026-09-30T17:46:46.461Z",
          "bronUrl": "https://www.anwb.nl/energie/actuele-tarieven"
        },
        "gasInkoopopslag": {
          "bedragInclBtw": 0.0768,
          "bedragExclBtw": 0.063471,
          "eenheid": "EUR/m3",
          "bron": "website",
          "geverifieerd": true,
          "sinds": "2026-09-26T20:50:05.481Z",
          "laatstGecontroleerd": "2026-09-30T17:46:46.461Z",
          "bronUrl": "https://www.anwb.nl/energie/actuele-tarieven"
        },
        "terugleverCorrectie": {
          "bedragInclBtw": 0,
          "bedragExclBtw": 0,
          "eenheid": "EUR/kWh",
          "bron": "handmatig",
          "geverifieerd": true,
          "sinds": "2026-09-24T00:00:00Z",
          "bronUrl": "https://www.anwb.nl/energie/actuele-tarieven"
        }
      },
      "laatstUitgevoerd": "2026-09-30T17:46:46.461Z"
    },
    {
      "id": "budget",
      "naam": "Budget Thuis (Budget Energie)",
      "website": "https://www.budgetthuis.nl",
      "tariefUrl": "https://www.budgetthuis.nl/energie/dynamisch-energiecontract",
      "producten": {
        "stroom": true,
        "gas": true
      },
      "kenmerken": {
        "automatischAfschakelen": null
      },
      "tarieven": {
        "stroomVastPerMaand": {
          "bedragInclBtw": 5.99,
          "bedragExclBtw": 4.95,
          "eenheid": "EUR/maand",
          "bron": "rekentool",
          "geverifieerd": true,
          "sinds": "2026-09-26T20:50:05.481Z",
          "laatstGecontroleerd": "2026-09-30T17:46:46.461Z",
          "bronUrl": "https://www.budgetthuis.nl/energie/dynamisch-energiecontract"
        },
        "stroomInkoopopslag": {
          "bedragInclBtw": 0.01682,
          "bedragExclBtw": 0.0139,
          "eenheid": "EUR/kWh",
          "bron": "rekentool",
          "geverifieerd": true,
          "sinds": "2026-09-26T20:50:05.481Z",
          "laatstGecontroleerd": "2026-09-30T17:46:46.461Z",
          "bronUrl": "https://www.budgetthuis.nl/energie/dynamisch-energiecontract"
        },
        "gasVastPerMaand": {
          "bedragInclBtw": 5.99,
          "bedragExclBtw": 4.95,
          "eenheid": "EUR/maand",
          "bron": "rekentool",
          "geverifieerd": true,
          "sinds": "2026-09-26T20:50:05.481Z",
          "laatstGecontroleerd": "2026-09-30T17:46:46.461Z",
          "bronUrl": "https://www.budgetthuis.nl/energie/dynamisch-energiecontract"
        },
        "gasInkoopopslag": {
          "bedragInclBtw": 0.06413,
          "bedragExclBtw": 0.053,
          "eenheid": "EUR/m3",
          "bron": "rekentool",
          "geverifieerd": true,
          "sinds": "2026-09-26T20:50:05.481Z",
          "laatstGecontroleerd": "2026-09-30T17:46:46.461Z",
          "bronUrl": "https://www.budgetthuis.nl/energie/dynamisch-energiecontract"
        },
        "terugleverCorrectie": {
          "bedragInclBtw": 0,
          "bedragExclBtw": 0,
          "eenheid": "EUR/kWh",
          "bron": "rekentool",
          "geverifieerd": true,
          "sinds": "2026-09-26T20:50:05.481Z",
          "laatstGecontroleerd": "2026-09-30T17:46:46.461Z",
          "bronUrl": "https://www.budgetthuis.nl/energie/dynamisch-energiecontract"
        }
      },
      "laatstUitgevoerd": "2026-09-30T17:46:46.461Z"
    },
    {
      "id": "easyenergy",
      "naam": "easyEnergy",
      "website": "https://www.easyenergy.com",
      "tariefUrl": "https://www.easyenergy.com/dynamische-energie",
      "producten": {
        "stroom": true,
        "gas": true
      },
      "kenmerken": {
        "automatischAfschakelen": null
      },
      "tarieven": {
        "stroomVastPerMaand": {
          "bedragInclBtw": 7,
          "bedragExclBtw": 5.785124,
          "eenheid": "EUR/maand",
          "bron": "handmatig",
          "geverifieerd": true,
          "sinds": "2026-09-29T00:00:00Z",
          "bronUrl": "https://klantworden.easyenergy.com/api/v1/fetch-products"
        },
        "stroomInkoopopslag": {
          "bedragInclBtw": 0.02178,
          "bedragExclBtw": 0.018,
          "eenheid": "EUR/kWh",
          "bron": "handmatig",
          "geverifieerd": true,
          "sinds": "2026-09-29T00:00:00Z",
          "bronUrl": "https://klantworden.easyenergy.com/api/v1/fetch-products"
        },
        "gasVastPerMaand": {
          "bedragInclBtw": 7,
          "bedragExclBtw": 5.785124,
          "eenheid": "EUR/maand",
          "bron": "handmatig",
          "geverifieerd": true,
          "sinds": "2026-09-29T00:00:00Z",
          "bronUrl": "https://klantworden.easyenergy.com/api/v1/fetch-products"
        },
        "gasInkoopopslag": {
          "bedragInclBtw": 0.12979,
          "bedragExclBtw": 0.107268,
          "eenheid": "EUR/m3",
          "bron": "handmatig",
          "geverifieerd": true,
          "sinds": "2026-09-29T00:00:00Z",
          "bronUrl": "https://klantworden.easyenergy.com/api/v1/fetch-products"
        },
        "terugleverCorrectie": {
          "bedragInclBtw": -0.02178,
          "bedragExclBtw": -0.018,
          "eenheid": "EUR/kWh",
          "bron": "handmatig",
          "geverifieerd": true,
          "sinds": "2026-09-29T00:00:00Z",
          "bronUrl": "https://klantworden.easyenergy.com/api/v1/fetch-products"
        }
      },
      "laatstUitgevoerd": "2026-09-30T17:46:46.461Z"
    },
    {
      "id": "eneco",
      "naam": "Eneco",
      "website": "https://www.eneco.nl",
      "tariefUrl": "https://www.eneco.nl/duurzame-energie/dynamisch-energiecontract/dynamische-tarieven/",
      "producten": {
        "stroom": true,
        "gas": true
      },
      "kenmerken": {
        "automatischAfschakelen": null
      },
      "tarieven": {
        "stroomVastPerMaand": {
          "bedragInclBtw": 7,
          "bedragExclBtw": 5.785124,
          "eenheid": "EUR/maand",
          "bron": "handmatig",
          "geverifieerd": true,
          "sinds": "2026-09-26T00:00:00Z",
          "bronUrl": "https://www.eneco.nl/duurzame-energie/bestellen2/"
        },
        "stroomInkoopopslag": {
          "bedragInclBtw": 0.02297,
          "bedragExclBtw": 0.018983,
          "eenheid": "EUR/kWh",
          "bron": "handmatig",
          "geverifieerd": true,
          "sinds": "2026-09-26T00:00:00Z",
          "bronUrl": "https://www.eneco.nl/duurzame-energie/bestellen2/"
        },
        "gasVastPerMaand": {
          "bedragInclBtw": 7,
          "bedragExclBtw": 5.785124,
          "eenheid": "EUR/maand",
          "bron": "handmatig",
          "geverifieerd": true,
          "sinds": "2026-09-26T00:00:00Z",
          "bronUrl": "https://www.eneco.nl/duurzame-energie/bestellen2/"
        },
        "gasInkoopopslag": {
          "bedragInclBtw": 0.10471,
          "bedragExclBtw": 0.086537,
          "eenheid": "EUR/m3",
          "bron": "handmatig",
          "geverifieerd": true,
          "sinds": "2026-09-26T00:00:00Z",
          "bronUrl": "https://www.eneco.nl/duurzame-energie/bestellen2/"
        },
        "terugleverCorrectie": {
          "bedragInclBtw": 0,
          "bedragExclBtw": 0,
          "eenheid": "EUR/kWh",
          "bron": "handmatig",
          "geverifieerd": true,
          "sinds": "2026-09-26T00:00:00Z",
          "bronUrl": "https://www.eneco.nl/duurzame-energie/dynamisch-energiecontract/"
        }
      },
      "laatstUitgevoerd": "2026-09-30T17:46:46.461Z"
    },
    {
      "id": "energiedirect",
      "naam": "Energiedirect",
      "website": "https://www.energiedirect.nl",
      "tariefUrl": "https://www.energiedirect.nl/energie/energiecontract/dynamisch",
      "producten": {
        "stroom": true,
        "gas": true
      },
      "kenmerken": {
        "automatischAfschakelen": null
      },
      "tarieven": {
        "stroomVastPerMaand": {
          "bedragInclBtw": 6.99,
          "bedragExclBtw": 5.77686,
          "eenheid": "EUR/maand",
          "bron": "handmatig",
          "geverifieerd": true,
          "sinds": "2026-09-29T00:00:00Z",
          "bronUrl": "https://www.energiedirect.nl/api/public/cplusactivation/offers/v1"
        },
        "stroomInkoopopslag": {
          "bedragInclBtw": 0.0205,
          "bedragExclBtw": 0.016942,
          "eenheid": "EUR/kWh",
          "bron": "handmatig",
          "geverifieerd": true,
          "sinds": "2026-09-29T00:00:00Z",
          "bronUrl": "https://www.energiedirect.nl/api/public/cplusactivation/offers/v1"
        },
        "gasVastPerMaand": {